{
 "id": "spell-commune",
 "name": "Commune",
 "name_raw": null,
 "system": "openfrp74",
 "available_to": [
  {
   "class": "cleric",
   "level": 5,
   "note": null
  }
 ],
 "range_raw": null,
 "range_inches": null,
 "duration_raw": null,
 "duration_turns": null,
 "duration_dice": null,
 "duration_formula": null,
 "reversible": false,
 "description": "The Cleric reaches to the powers above with three questions, their knowledge and truthfulness near total. Communing is permitted once a week at most (the referee may allow less), and once a year a special communing doubles the questions.",
 "related_spells": [],
 "interpretation_records": [],
 "period_conventions": [],
 "source": {
  "work": "OpenFRP74",
  "booklet": "v1",
  "page": "p34",
  "blocks": [
   5
  ],
  "content_sha256": [
   "b3dfa630314fcfa5340b25cd91f5236f915799ae5777dd432d34095f98f99661"
  ],
  "also": [
   {
    "booklet": "v1",
    "page": "p22",
    "blocks": [
     3
    ],
    "content_sha256": [
     "ca01bf1b7ef45b812256356168f1c9122b8a0e7a067fb7a56b78965367e9476f"
    ],
    "note": "Clerics spells table 4th-5th"
   }
  ]
 },
 "extraction": {
  "date": "2026-07-17",
  "model": "claude-opus-4-8",
  "notes": null
 }
}
