{
 "id": "spell-transmute-rock-to-mud",
 "name": "Transmute Rock to Mud",
 "name_raw": null,
 "system": "openfrp74",
 "available_to": [
  {
   "class": "magic-user",
   "level": 5,
   "note": null
  }
 ],
 "range_raw": "12\"",
 "range_inches": 12,
 "duration_raw": "until reversed or evaporated (3-18 days)",
 "duration_turns": null,
 "duration_dice": null,
 "duration_formula": null,
 "reversible": true,
 "description": "In one turn, earth, sand, and rock itself melt to mud across up to 30 square inches of tabletop. Creatures wading in are mired — sinking if heavy enough, else crawling at a tenth of their movement, unless they fly or levitate. Only the reversed incantation or slow evaporation (3-18 days) restores the ground. Range: 12\".",
 "related_spells": [],
 "interpretation_records": [],
 "period_conventions": [
  "evaporation 3d6 days"
 ],
 "source": {
  "work": "OpenFRP74",
  "booklet": "v1",
  "page": "p29",
  "blocks": [
   1
  ],
  "content_sha256": [
   "3bf8c1ec47d88f0792af8d2e1681c37e5fa770f442b4d2cbf8eee6616c0721d8"
  ],
  "also": [
   {
    "booklet": "v1",
    "page": "p21",
    "blocks": [
     4
    ],
    "content_sha256": [
     "108543317cc7c685732e6ada51d0692dd2939b25aaa2512d8a50927dd08466e1"
    ],
    "note": "Magic-Users spells table, 4th-6th levels (level index)"
   }
  ]
 },
 "extraction": {
  "date": "2026-07-17",
  "model": "claude-opus-4-8",
  "notes": null
 }
}
