{
 "id": "spell-cure-serious-wounds",
 "name": "Cure Serious Wounds",
 "name_raw": null,
 "system": "openfrp74",
 "available_to": [
  {
   "class": "cleric",
   "level": 4,
   "note": null
  }
 ],
 "range_raw": null,
 "range_inches": null,
 "duration_raw": null,
 "duration_turns": null,
 "duration_dice": null,
 "duration_formula": null,
 "reversible": true,
 "description": "As Cure Light Wounds doubled: roll two dice, add one pip to each, and remove 4-14 hit points of damage. Reversed by Anti-Clerics.",
 "related_spells": [
  "spell-cure-light-wounds"
 ],
 "interpretation_records": [],
 "period_conventions": [
  "healing: 2d6+2"
 ],
 "source": {
  "work": "OpenFRP74",
  "booklet": "v1",
  "page": "p33",
  "blocks": [
   14
  ],
  "content_sha256": [
   "e7a8cee9531e830bcf1439818cac1e094b83ec68c61986369e0b5a681170749c"
  ],
  "also": [
   {
    "booklet": "v1",
    "page": "p22",
    "blocks": [
     3
    ],
    "content_sha256": [
     "ca01bf1b7ef45b812256356168f1c9122b8a0e7a067fb7a56b78965367e9476f"
    ],
    "note": "Clerics spells table 4th-5th"
   }
  ]
 },
 "extraction": {
  "date": "2026-07-17",
  "model": "claude-opus-4-8",
  "notes": null
 }
}
