{
 "id": "spell-cure-light-wounds",
 "name": "Cure Light Wounds",
 "name_raw": null,
 "system": "openfrp74",
 "available_to": [
  {
   "class": "cleric",
   "level": 1,
   "note": null
  }
 ],
 "range_raw": null,
 "range_inches": null,
 "duration_raw": "one full turn to take effect",
 "duration_turns": null,
 "duration_dice": null,
 "duration_formula": null,
 "reversible": true,
 "description": "Over one full turn the Cleric's touch knits wounds: roll a die, add one pip, and remove that many hit points of damage (2-7) from the wounded — elves and dwarves included. Reversed by Anti-Clerics.",
 "related_spells": [],
 "interpretation_records": [],
 "period_conventions": [
  "healing: 1d6+1"
 ],
 "source": {
  "work": "OpenFRP74",
  "booklet": "v1",
  "page": "p32",
  "blocks": [
   5
  ],
  "content_sha256": [
   "44b49fe702fae04ef5853b1b1a00eea89d4875884b4548687592084edaf02ffd"
  ],
  "also": [
   {
    "booklet": "v1",
    "page": "p22",
    "blocks": [
     2
    ],
    "content_sha256": [
     "461d00deb7a28f570fac2ad2436f1739c7e0f7a5743ebcd7467cdd3a88c14ab2"
    ],
    "note": "Clerics spells table 1st-3rd (underlines mark Anti-Cleric-reversible)"
   }
  ]
 },
 "extraction": {
  "date": "2026-07-17",
  "model": "claude-opus-4-8",
  "notes": null
 }
}
