{
 "id": "spell-invisible-stalker",
 "name": "Invisible Stalker",
 "name_raw": null,
 "system": "openfrp74",
 "available_to": [
  {
   "class": "magic-user",
   "level": 6,
   "note": null
  }
 ],
 "range_raw": null,
 "range_inches": null,
 "duration_raw": "until mission accomplished",
 "duration_turns": null,
 "duration_dice": null,
 "duration_formula": null,
 "reversible": false,
 "description": "Conjures an extra-dimensional hunter bound by a single word of command. The Stalker pursues its mission to completion, however far and however long, and cannot be dispelled once summoned — only destroyed. Its particulars are given in Volume II.",
 "related_spells": [],
 "interpretation_records": [],
 "period_conventions": [],
 "source": {
  "work": "OpenFRP74",
  "booklet": "v1",
  "page": "p31",
  "blocks": [
   4
  ],
  "content_sha256": [
   "215ece5d458466a906df42fd43dcf7f215f7ef02856f14fc7a6c4edaf4ec48a7"
  ],
  "also": [
   {
    "booklet": "v1",
    "page": "p21",
    "blocks": [
     4
    ],
    "content_sha256": [
     "108543317cc7c685732e6ada51d0692dd2939b25aaa2512d8a50927dd08466e1"
    ],
    "note": "Magic-Users spells table, 4th-6th levels (level index)"
   }
  ]
 },
 "extraction": {
  "date": "2026-07-17",
  "model": "claude-opus-4-8",
  "notes": null
 }
}
