{
 "id": "spell-insect-plague",
 "name": "Insect Plague",
 "name_raw": null,
 "system": "openfrp74",
 "available_to": [
  {
   "class": "cleric",
   "level": 5,
   "note": null
  }
 ],
 "range_raw": "48\"",
 "range_inches": 48,
 "duration_raw": "1 game day",
 "duration_turns": null,
 "duration_dice": null,
 "duration_formula": null,
 "reversible": false,
 "description": "A vast cloud of insects gathers at the Cleric's call and goes where he sends it within range, blotting sight and routing creatures of fewer than three hit dice. It covers 36 square inches. Works only above ground. Duration: 1 game day. Range: 48\".",
 "related_spells": [],
 "interpretation_records": [],
 "period_conventions": [],
 "source": {
  "work": "OpenFRP74",
  "booklet": "v1",
  "page": "p34",
  "blocks": [
   7
  ],
  "content_sha256": [
   "e985adce322aef9319193b6102a158172775bcd1546253f12ab6dd824a5a4540"
  ],
  "also": [
   {
    "booklet": "v1",
    "page": "p22",
    "blocks": [
     3
    ],
    "content_sha256": [
     "ca01bf1b7ef45b812256356168f1c9122b8a0e7a067fb7a56b78965367e9476f"
    ],
    "note": "Clerics spells table 4th-5th"
   }
  ]
 },
 "extraction": {
  "date": "2026-07-17",
  "model": "claude-opus-4-8",
  "notes": null
 }
}
