{
 "id": "spell-polymorph-self",
 "name": "Polymorph Self",
 "name_raw": null,
 "system": "openfrp74",
 "available_to": [
  {
   "class": "magic-user",
   "level": 4,
   "note": null
  }
 ],
 "range_raw": null,
 "range_inches": null,
 "duration_raw": "6 turns + the level of the Magic-User",
 "duration_turns": null,
 "duration_dice": null,
 "duration_formula": "6 + caster level",
 "reversible": false,
 "description": "The caster takes the shape of anything he desires — but only the shape. He gains none of the combat powers of the form: become a dragon and he may fly, but he can neither fight nor breathe as one. Duration: 6 turns plus the caster's level.",
 "related_spells": [
  "spell-polymorph-others"
 ],
 "interpretation_records": [],
 "period_conventions": [],
 "source": {
  "work": "OpenFRP74",
  "booklet": "v1",
  "page": "p26",
  "blocks": [
   9
  ],
  "content_sha256": [
   "4533a548d9d9243a6cdda9408a596a3449c9c6d5297571aed8c903fa2e4a67eb"
  ],
  "also": [
   {
    "booklet": "v1",
    "page": "p21",
    "blocks": [
     4
    ],
    "content_sha256": [
     "108543317cc7c685732e6ada51d0692dd2939b25aaa2512d8a50927dd08466e1"
    ],
    "note": "Magic-Users spells table, 4th-6th levels (level index)"
   }
  ]
 },
 "extraction": {
  "date": "2026-07-17",
  "model": "claude-opus-4-8",
  "notes": null
 }
}
