{
 "id": "spell-bless",
 "name": "Bless",
 "name_raw": null,
 "system": "openfrp74",
 "available_to": [
  {
   "class": "cleric",
   "level": 2,
   "note": null
  }
 ],
 "range_raw": null,
 "range_inches": null,
 "duration_raw": "six turns",
 "duration_turns": 6,
 "duration_dice": null,
 "duration_formula": null,
 "reversible": true,
 "description": "Upon comrades not yet in combat the Cleric bestows his benison: morale rises by +1 and attack dice gain +1. The blessing lasts six turns. Reversed by Anti-Clerics.",
 "related_spells": [],
 "interpretation_records": [],
 "period_conventions": [],
 "source": {
  "work": "OpenFRP74",
  "booklet": "v1",
  "page": "p33",
  "blocks": [
   5
  ],
  "content_sha256": [
   "6def9af33db7d1ae97c3afb642cceb6fd5c2cf878f5cbdf43c65651964fd3143"
  ],
  "also": [
   {
    "booklet": "v1",
    "page": "p22",
    "blocks": [
     2
    ],
    "content_sha256": [
     "461d00deb7a28f570fac2ad2436f1739c7e0f7a5743ebcd7467cdd3a88c14ab2"
    ],
    "note": "Clerics spells table 1st-3rd (underlines mark Anti-Cleric-reversible)"
   }
  ]
 },
 "extraction": {
  "date": "2026-07-17",
  "model": "claude-opus-4-8",
  "notes": null
 }
}
